{"artifact_id":"758526873b8a3a2681f655c064dee52f8bd33749accd499d015420dbe8e11b9a","calibration":{"method":"identity"},"contract_version":"positional-features/v1","export_tolerance":1e-07,"feature_contract_sha256":"7997e82634ffb78bac9d40b21c6715c8bb10cd8934e629a7a5fa09aed066bb67","feature_indices":[0,1,2,3,4,5,6,7],"feature_order":["shot_distance_m","goal_opening_angle_deg","absolute_lateral_offset_m","visible_defender_count","defenders_in_cone_count","nearest_visible_defender_distance_m","goalkeeper_distance_to_goal_m","goalkeeper_distance_to_shot_m"],"licensing":{"code":"Independent project implementation; no SoccerBoard code or weights","data":"StatsBomb Open Data; non-commercial portfolio scope; release review required","libraries":{"XGBoost":"Apache-2.0","scikit-learn":"BSD-3-Clause"}},"model_version":"full_xgboost","objective":"binary:logistic","parameters":{"accumulator_precision":"float32","base_margin":-2.2584407329559326,"input_precision":"float32","kind":"xgboost","trees":[[{"feature":7,"left":1,"right":2,"threshold":7.385331630706787},{"feature":1,"left":3,"right":4,"threshold":52.06468200683594},{"feature":7,"left":5,"right":6,"threshold":10.004291534423828},{"leaf":0.09719961881637573},{"leaf":0.21577763557434082},{"leaf":0.034977033734321594},{"leaf":-0.03300873935222626}],[{"feature":7,"left":1,"right":2,"threshold":8.956320762634277},{"feature":1,"left":3,"right":4,"threshold":50.21390914916992},{"feature":1,"left":5,"right":6,"threshold":23.100900650024414},{"leaf":0.06847688555717468},{"leaf":0.17093144357204437},{"leaf":-0.03689967468380928},{"leaf":0.0067677791230380535}],[{"feature":7,"left":1,"right":2,"threshold":9.3295316696167},{"feature":1,"left":3,"right":4,"threshold":41.80862808227539},{"feature":1,"left":5,"right":6,"threshold":22.99791145324707},{"leaf":0.05242660641670227},{"leaf":0.1276015192270279},{"leaf":-0.03646189719438553},{"leaf":0.002428865060210228}],[{"feature":7,"left":1,"right":2,"threshold":10.004291534423828},{"feature":1,"left":3,"right":4,"threshold":41.80862808227539},{"feature":1,"left":5,"right":6,"threshold":23.21401596069336},{"leaf":0.04345904290676117},{"leaf":0.11107871681451797},{"leaf":-0.0362730510532856},{"leaf":-0.0015489035286009312}],[{"feature":7,"left":1,"right":2,"threshold":10.004291534423828},{"feature":4,"left":3,"right":4,"threshold":1.0},{"feature":1,"left":5,"right":6,"threshold":23.21401596069336},{"leaf":0.07694832235574722},{"leaf":0.0184293482452631},{"leaf":-0.035542428493499756},{"leaf":-0.001473755924962461}],[{"feature":7,"left":1,"right":2,"threshold":10.004291534423828},{"feature":2,"left":3,"right":4,"threshold":5.355000019073486},{"feature":1,"left":5,"right":6,"threshold":20.052602767944336},{"leaf":0.07716263085603714},{"leaf":0.025126073509454727},{"leaf":-0.037543974816799164},{"leaf":-0.010168591514229774}],[{"feature":7,"left":1,"right":2,"threshold":10.004291534423828},{"feature":7,"left":3,"right":4,"threshold":6.157191276550293},{"feature":7,"left":5,"right":6,"threshold":15.969399452209473},{"leaf":0.0738009512424469},{"leaf":0.024643132463097572},{"leaf":-0.012911736033856869},{"leaf":-0.038654252886772156}],[{"feature":7,"left":1,"right":2,"threshold":10.004291534423828},{"feature":4,"left":3,"right":4,"threshold":1.0},{"feature":1,"left":5,"right":6,"threshold":20.052602767944336},{"leaf":0.059319425374269485},{"leaf":0.01133922953158617},{"leaf":-0.03620816767215729},{"leaf":-0.009013531729578972}],[{"feature":7,"left":1,"right":2,"threshold":9.3295316696167},{"feature":1,"left":3,"right":4,"threshold":18.250898361206055},{"feature":1,"left":5,"right":6,"threshold":22.99791145324707},{"leaf":-0.025466589257121086},{"leaf":0.05074290558695793},{"leaf":-0.032293740659952164},{"leaf":0.0021778985392302275}],[{"feature":7,"left":1,"right":2,"threshold":10.004291534423828},{"feature":1,"left":3,"right":4,"threshold":54.032012939453125},{"feature":7,"left":5,"right":6,"threshold":15.969399452209473},{"leaf":0.028132760897278786},{"leaf":0.0838242843747139},{"leaf":-0.010978182777762413},{"leaf":-0.036791328340768814}],[{"feature":1,"left":1,"right":2,"threshold":23.21401596069336},{"feature":6,"left":3,"right":4,"threshold":5.69321346282959},{"feature":4,"left":5,"right":6,"threshold":1.0},{"leaf":-0.03111318312585354},{"leaf":0.018694525584578514},{"leaf":0.05576475337147713},{"leaf":0.003634597407653928}],[{"feature":7,"left":1,"right":2,"threshold":10.004291534423828},{"feature":2,"left":3,"right":4,"threshold":3.484999895095825},{"feature":7,"left":5,"right":6,"threshold":18.47760009765625},{"leaf":0.05714577063918114},{"leaf":0.018769344314932823},{"leaf":-0.014012329280376434},{"leaf":-0.03924647346138954}],[{"feature":1,"left":1,"right":2,"threshold":23.21401596069336},{"feature":6,"left":3,"right":4,"threshold":5.69321346282959},{"feature":4,"left":5,"right":6,"threshold":1.0},{"leaf":-0.029832500964403152},{"leaf":0.01703978143632412},{"leaf":0.048722002655267715},{"leaf":0.0024957978166639805}],[{"feature":7,"left":1,"right":2,"threshold":7.385331630706787},{"feature":1,"left":3,"right":4,"threshold":82.2221908569336},{"feature":1,"left":5,"right":6,"threshold":20.052602767944336},{"leaf":0.03615681454539299},{"leaf":0.11025595664978027},{"leaf":-0.03168092668056488},{"leaf":0.0011645916383713484}],[{"feature":1,"left":1,"right":2,"threshold":23.21401596069336},{"feature":6,"left":3,"right":4,"threshold":5.69321346282959},{"feature":4,"left":5,"right":6,"threshold":1.0},{"leaf":-0.0285160094499588},{"leaf":0.015369169414043427},{"leaf":0.04279657453298569},{"leaf":0.0015752295730635524}],[{"feature":7,"left":1,"right":2,"threshold":10.004291534423828},{"feature":1,"left":3,"right":4,"threshold":18.120014190673828},{"feature":7,"left":5,"right":6,"threshold":18.47760009765625},{"leaf":-0.026422401890158653},{"leaf":0.030264172703027725},{"leaf":-0.0120663708075881},{"leaf":-0.037150971591472626}],[{"feature":1,"left":1,"right":2,"threshold":23.21401596069336},{"feature":6,"left":3,"right":4,"threshold":5.69321346282959},{"feature":4,"left":5,"right":6,"threshold":1.0},{"leaf":-0.027217095717787743},{"leaf":0.014369179494678974},{"leaf":0.037821680307388306},{"leaf":0.0007326628547161818}],[{"feature":7,"left":1,"right":2,"threshold":10.004291534423828},{"feature":1,"left":3,"right":4,"threshold":82.2221908569336},{"feature":1,"left":5,"right":6,"threshold":17.65279769897461},{"leaf":0.01977618783712387},{"leaf":0.09405428916215897},{"leaf":-0.0343206413090229},{"leaf":-0.009632579050958157}],[{"feature":7,"left":1,"right":2,"threshold":7.385331630706787},{"feature":5,"left":3,"right":4,"threshold":1.089268684387207},{"feature":1,"left":5,"right":6,"threshold":17.65279769897461},{"leaf":0.0019245160510763526},{"leaf":0.03938090056180954},{"leaf":-0.03373710438609123},{"leaf":-0.0033562921453267336}],[{"feature":1,"left":1,"right":2,"threshold":23.21401596069336},{"feature":1,"left":3,"right":4,"threshold":17.54774284362793},{"feature":3,"left":5,"right":6,"threshold":7.0},{"leaf":-0.03259596228599548},{"leaf":-0.007903140969574451},{"leaf":0.03929055482149124},{"leaf":0.005717347841709852}],[{"feature":1,"left":1,"right":2,"threshold":27.772621154785156},{"feature":6,"left":3,"right":4,"threshold":3.9091567993164062},{"feature":3,"left":5,"right":6,"threshold":7.0},{"leaf":-0.02514200285077095},{"leaf":0.005940241273492575},{"leaf":0.046614259481430054},{"leaf":0.011282653547823429}],[{"feature":7,"left":1,"right":2,"threshold":13.719648361206055},{"feature":1,"left":3,"right":4,"threshold":41.80862808227539},{"feature":0,"left":5,"right":6,"threshold":24.57126235961914},{"leaf":0.005571506451815367},{"leaf":0.03719664737582207},{"leaf":-0.01954716630280018},{"leaf":-0.04153337702155113}],[{"feature":1,"left":1,"right":2,"threshold":20.052602767944336},{"feature":0,"left":3,"right":4,"threshold":24.57126235961914},{"feature":4,"left":5,"right":6,"threshold":1.0},{"leaf":-0.018057623878121376},{"leaf":-0.041083186864852905},{"leaf":0.026528382673859596},{"leaf":-0.006002673413604498}],[{"feature":7,"left":1,"right":2,"threshold":7.385331630706787},{"feature":5,"left":3,"right":4,"threshold":1.089268684387207},{"feature":1,"left":5,"right":6,"threshold":17.65279769897461},{"leaf":-0.0018077159766107798},{"leaf":0.03180136904120445},{"leaf":-0.030819404870271683},{"leaf":-0.0032921351958066225}],[{"feature":7,"left":1,"right":2,"threshold":13.719648361206055},{"feature":1,"left":3,"right":4,"threshold":52.06468200683594},{"feature":0,"left":5,"right":6,"threshold":24.57126235961914},{"leaf":0.006427800748497248},{"leaf":0.04086706414818764},{"leaf":-0.0180366113781929},{"leaf":-0.04006434604525566}],[{"feature":1,"left":1,"right":2,"threshold":20.052602767944336},{"feature":0,"left":3,"right":4,"threshold":24.57126235961914},{"feature":6,"left":5,"right":6,"threshold":3.9091567993164062},{"leaf":-0.016631875187158585},{"leaf":-0.039608340710401535},{"leaf":0.0008167020860128105},{"leaf":0.031410884112119675}],[{"feature":1,"left":1,"right":2,"threshold":27.772621154785156},{"feature":6,"left":3,"right":4,"threshold":3.9091567993164062},{"feature":3,"left":5,"right":6,"threshold":6.0},{"leaf":-0.022283099591732025},{"leaf":0.005180093459784985},{"leaf":0.04536299407482147},{"leaf":0.010770936496555805}],[{"feature":1,"left":1,"right":2,"threshold":17.881189346313477},{"feature":0,"left":3,"right":4,"threshold":24.57126235961914},{"feature":4,"left":5,"right":6,"threshold":1.0},{"leaf":-0.020674889907240868},{"leaf":-0.03880740702152252},{"leaf":0.020219186320900917},{"leaf":-0.008445598185062408}],[{"feature":1,"left":1,"right":2,"threshold":27.772621154785156},{"feature":6,"left":3,"right":4,"threshold":3.9091567993164062},{"feature":5,"left":5,"right":6,"threshold":3.5546061992645264},{"leaf":-0.021258145570755005},{"leaf":0.0047792172990739346},{"leaf":0.011985642835497856},{"leaf":0.05461590364575386}],[{"feature":1,"left":1,"right":2,"threshold":17.881189346313477},{"feature":0,"left":3,"right":4,"threshold":